{"algorithmVersion":"palette-algorithm.v1.1","candidateId":"scale500-tmdb-19123","method":"poster-algorithm","override":null,"palette":["#201010","#ffd020"],"schemaVersion":"palette-artifact.v1","sourcePosterHash":"sha256:7c3ef9ca650dce6728d09786587432f963971dac43b7722c5c5ac365b0e1ba8d","sourcePosterIdentity":{"posterPath":"/h4LISjDFnpWtAVsp4kFbDaKw6UZ.jpg"},"tmdbId":19123}
