{"algorithmVersion":"palette-algorithm.v1.1","candidateId":"exp100-tmdb-283566","method":"poster-algorithm","override":null,"palette":["#000000","#ffffff"],"schemaVersion":"palette-artifact.v1","sourcePosterHash":"sha256:f06e2400365486398a2148f84821700470513fb572ac67085d29c196b6ab2d32","sourcePosterIdentity":{"posterPath":"/md5wZRRj8biHrGtyitgBZo7674t.jpg"},"tmdbId":283566}
