{"algorithmVersion":"palette-algorithm.v1.1","candidateId":"scale500-tmdb-34069","method":"poster-algorithm","override":null,"palette":["#000000","#507080"],"schemaVersion":"palette-artifact.v1","sourcePosterHash":"sha256:37922d1dbb7ef2bb62af158b2c2ef5abacf74c0a6e13a7d982a6fa04e94cdddc","sourcePosterIdentity":{"posterPath":"/5CFTLlGbRMtNI0ZyfRL4YC1qD4f.jpg"},"tmdbId":34069}
