{"algorithmVersion":"palette-algorithm.v1.1","candidateId":"scale500-tmdb-13761","method":"poster-algorithm","override":null,"palette":["#000000","#b0d0e0"],"schemaVersion":"palette-artifact.v1","sourcePosterHash":"sha256:c135be7cad7ad0a64eb181d59c7f73f5dc329f788c16d52ca3052859d8c7eaa6","sourcePosterIdentity":{"posterPath":"/sUvNHmUGJP3RkYpE65i7ZF0v0nE.jpg"},"tmdbId":13761}
