{"algorithmVersion":"palette-algorithm.v1.1","candidateId":"scale500-tmdb-11333","method":"poster-algorithm","override":null,"palette":["#201010","#ffffff"],"schemaVersion":"palette-artifact.v1","sourcePosterHash":"sha256:aaf89cee23b27bd6e5e82c60ad095efeaa79936560fc6a50d10431cd5667863e","sourcePosterIdentity":{"posterPath":"/8kSgFV7nvzLVJhmVkq8n4k2VoC0.jpg"},"tmdbId":11333}
