{"algorithmVersion":"palette-algorithm.v1.1","candidateId":"scale500-tmdb-11220","method":"poster-algorithm","override":null,"palette":["#202020","#ffffff"],"schemaVersion":"palette-artifact.v1","sourcePosterHash":"sha256:c5d48423bc56a2a85c7d2c3d05a77def327dd71a3710aaff76bd67ac198f6fdb","sourcePosterIdentity":{"posterPath":"/yyM9BPdwttK5LKZSLvHae7QPKo1.jpg"},"tmdbId":11220}
