{"algorithmVersion":"palette-algorithm.v1.1","candidateId":"scale500-tmdb-82505","method":"poster-algorithm","override":null,"palette":["#000000","#fff0a0"],"schemaVersion":"palette-artifact.v1","sourcePosterHash":"sha256:744cfc33eb423b40dedc5f501a217d1bf13cd72d6fddd25cca7f868ec202ecfb","sourcePosterIdentity":{"posterPath":"/bgHeZ5g7YyxKcwWw1tgyAMy0czy.jpg"},"tmdbId":82505}
